{
  "$schema": "../plugin-schema.json",
  "id": "sample-junction-rule",
  "version": "1.0.0",
  "apiVersion": "1.0.0",
  "name": "Sample Junction Rule",
  "description": "Adds a new junction template for deployment strategy decisions - deterministic",
  "deterministic": true,
  "permissions": {
    "network": false,
    "filesystem": false,
    "env": false
  },
  "capabilities": ["registerDecisionType"],
  "entry": "index.js",
  "author": "Reach OSS",
  "license": "MIT"
}
