{
  "$schema": "../plugin-schema.json",
  "id": "pack-replay-first-ci",
  "version": "1.0.0",
  "apiVersion": "1.0.0",
  "name": "Replay-First CI Pack Plugin",
  "description": "Deterministic CI with replay verification and proof generation",
  "deterministic": true,
  "permissions": {
    "network": false,
    "filesystem": true,
    "env": false
  },
  "capabilities": ["registerAnalyzePrAnalyzer", "registerRenderer"],
  "entry": "index.js",
  "author": "Reach OSS",
  "license": "MIT"
}
