{
  "$schema": "../plugin-schema.json",
  "id": "sample-export-hook",
  "version": "1.0.0",
  "apiVersion": "1.0.0",
  "name": "Sample Export Hook",
  "description": "Adds extra metadata file to export bundle deterministically",
  "deterministic": true,
  "permissions": {
    "network": false,
    "filesystem": false,
    "env": false
  },
  "capabilities": ["registerRenderer"],
  "entry": "index.js",
  "author": "Reach OSS",
  "license": "MIT"
}
