{
  "$schema": "../plugin-schema.json",
  "id": "pack-drift-hunter",
  "version": "1.0.0",
  "apiVersion": "1.0.0",
  "name": "Drift Hunter Pack Plugin",
  "description": "Detects configuration drift and unexpected changes between runs",
  "deterministic": true,
  "permissions": {
    "network": false,
    "filesystem": true,
    "env": false
  },
  "capabilities": ["registerAnalyzePrAnalyzer", "registerEvidenceExtractor"],
  "entry": "index.js",
  "author": "Reach OSS",
  "license": "MIT"
}
