{
  "$schema": "../plugin-schema.json",
  "id": "template-plugin",
  "version": "0.1.0",
  "apiVersion": "1.0.0",
  "name": "Template Plugin",
  "description": "Minimal plugin scaffold - copy and modify to create your own",
  "deterministic": true,
  "permissions": {
    "network": false,
    "filesystem": false,
    "env": false
  },
  "capabilities": ["registerAnalyzePrAnalyzer"],
  "entry": "index.js",
  "author": "Your Name",
  "license": "MIT"
}
