{
  "$schema": "../plugin-schema.json",
  "id": "sample-summarizer",
  "version": "1.0.0",
  "apiVersion": "1.0.0",
  "name": "Sample Summarizer",
  "description": "Summarizes evidence metadata for quick overview - no side effects",
  "deterministic": true,
  "permissions": {
    "network": false,
    "filesystem": false,
    "env": false
  },
  "capabilities": ["registerEvidenceExtractor"],
  "entry": "index.js",
  "author": "Reach OSS",
  "license": "MIT"
}
