{
  "$schema": "../plugin-schema.json",
  "id": "renderer-example",
  "version": "1.0.0",
  "apiVersion": "1.0.0",
  "name": "Example Output Renderer",
  "description": "Custom output formatters for JSON, Markdown, and HTML",
  "deterministic": true,
  "permissions": {
    "network": false,
    "filesystem": false,
    "env": false
  },
  "capabilities": ["registerRenderer"],
  "entry": "index.js",
  "author": "reach-examples",
  "license": "MIT"
}
